[I 2025-07-14 21:56:02,299] Trial 62 finished with value: 0.6321814810765789 and parameters: {'model': 'gradient_boosting', 'n_estimators': 151, 'gb_learning_rate': 0.062335492157744254, 'max_depth': 7, 'min_samples_split': 9, 'min_samples_leaf': 6, 'subsample': 0.9556526709197479}. Best is trial 61 with value: 0.6326781482693665.
[I 2025-07-14 22:02:52,367] Trial 63 finished with value: 0.6315125447871653 and parameters: {'model': 'gradient_boosting', 'n_estimators': 160, 'gb_learning_rate': 0.04721913147904301, 'max_depth': 7, 'min_samples_split': 10, 'min_samples_leaf': 6, 'subsample': 0.9499795871571932}. Best is trial 61 with value: 0.6326781482693665.
[I 2025-07-14 22:09:52,538] Trial 64 finished with value: 0.632195040705212 and parameters: {'model': 'gradient_boosting', 'n_estimators': 162, 'gb_learning_rate': 0.043244188663653926, 'max_depth': 7, 'min_samples_split': 13, 'min_samples_leaf': 6, 'subsample': 0.962211160519084}. Best is trial 61 with value: 0.6326781482693665.
[I 2025-07-14 22:16:38,658] Trial 65 finished with value: 0.6311786953386714 and parameters: {'model': 'gradient_boosting', 'n_estimators': 161, 'gb_learning_rate': 0.030331865714068533, 'max_depth': 7, 'min_samples_split': 14, 'min_samples_leaf': 6, 'subsample': 0.9497879433773558}. Best is trial 61 with value: 0.6326781482693665.
[I 2025-07-14 22:23:47,474] Trial 66 finished with value: 0.6316852531794142 and parameters: {'model': 'gradient_boosting', 'n_estimators': 163, 'gb_learning_rate': 0.031136574656508126, 'max_depth': 7, 'min_samples_split': 15, 'min_samples_leaf': 8, 'subsample': 0.9675159460326571}. Best is trial 61 with value: 0.6326781482693665.
[I 2025-07-14 22:30:57,415] Trial 67 finished with value: 0.6301437966361377 and parameters: {'model': 'gradient_boosting', 'n_estimators': 166, 'gb_learning_rate': 0.026773400125147635, 'max_depth': 7, 'min_samples_split': 15, 'min_samples_leaf': 8, 'subsample': 0.9726001720406044}. Best is trial 61 with value: 0.6326781482693665.
[I 2025-07-14 22:31:03,326] Trial 68 finished with value: -3552376.403918598 and parameters: {'model': 'linear_regression', 'fit_intercept': False}. Best is trial 61 with value: 0.6326781482693665.
[I 2025-07-14 22:31:49,422] Trial 69 finished with value: 0.5793436523027868 and parameters: {'model': 'random_forest', 'n_estimators': 158, 'max_depth': 9, 'min_samples_split': 14, 'min_samples_leaf': 6, 'rf_max_features': 'sqrt'}. Best is trial 61 with value: 0.6326781482693665.
[I 2025-07-14 22:40:22,266] Trial 70 finished with value: 0.6347132148840355 and parameters: {'model': 'gradient_boosting', 'n_estimators': 175, 'gb_learning_rate': 0.04160763244965771, 'max_depth': 8, 'min_samples_split': 16, 'min_samples_leaf': 8, 'subsample': 0.9567507406672465}. Best is trial 70 with value: 0.6347132148840355.
[I 2025-07-14 22:49:01,884] Trial 71 finished with value: 0.6329413432966471 and parameters: {'model': 'gradient_boosting', 'n_estimators': 176, 'gb_learning_rate': 0.04538375790177626, 'max_depth': 8, 'min_samples_split': 16, 'min_samples_leaf': 8, 'subsample': 0.9574212408221479}. Best is trial 70 with value: 0.6347132148840355.
[I 2025-07-14 22:58:03,774] Trial 72 finished with value: 0.6298638997843774 and parameters: {'model': 'gradient_boosting', 'n_estimators': 177, 'gb_learning_rate': 0.04243638165598004, 'max_depth': 8, 'min_samples_split': 17, 'min_samples_leaf': 8, 'subsample': 0.9985067228174163}. Best is trial 70 with value: 0.6347132148840355.
[I 2025-07-14 23:06:35,244] Trial 73 finished with value: 0.6335667834587925 and parameters: {'model': 'gradient_boosting', 'n_estimators': 173, 'gb_learning_rate': 0.0465692715244073, 'max_depth': 8, 'min_samples_split': 16, 'min_samples_leaf': 8, 'subsample': 0.9642825972612921}. Best is trial 70 with value: 0.6347132148840355.
[I 2025-07-14 23:14:52,650] Trial 74 finished with value: 0.6315190870068231 and parameters: {'model': 'gradient_boosting', 'n_estimators': 175, 'gb_learning_rate': 0.021423262530591437, 'max_depth': 8, 'min_samples_split': 16, 'min_samples_leaf': 8, 'subsample': 0.9769570368636745}. Best is trial 70 with value: 0.6347132148840355.
[I 2025-07-14 23:14:53,137] Trial 75 finished with value: 0.49666863441641 and parameters: {'model': 'decision_tree', 'max_depth': 10, 'min_samples_split': 18, 'min_samples_leaf': 10, 'dt_max_features': 'sqrt'}. Best is trial 70 with value: 0.6347132148840355.
[I 2025-07-14 23:24:53,712] Trial 76 finished with value: 0.6333222794036518 and parameters: {'model': 'gradient_boosting', 'n_estimators': 184, 'gb_learning_rate': 0.04355009841717364, 'max_depth': 9, 'min_samples_split': 15, 'min_samples_leaf': 9, 'subsample': 0.9652083517805846}. Best is trial 70 with value: 0.6347132148840355.
[I 2025-07-14 23:35:31,952] Trial 77 finished with value: 0.6349931107854472 and parameters: {'model': 'gradient_boosting', 'n_estimators': 195, 'gb_learning_rate': 0.0412780920994139, 'max_depth': 9, 'min_samples_split': 16, 'min_samples_leaf': 9, 'subsample': 0.969206550135477}. Best is trial 77 with value: 0.6349931107854472.
Best trial: 77. Best value: 0.634993:  78%|█████████████████████████████████▌         | 78/100 [5:08:12<2:54:40, 476.39s/it]WARNING:tensorflow:5 out of the last 21 calls to <function TensorFlowTrainer.make_predict_function.<locals>.one_step_on_data_distributed at 0x3f8ecab90> triggered tf.function retracing. Tracing is expensive and the excessive number of tracings could be due to (1) creating @tf.function repeatedly in a loop, (2) passing tensors with different shapes, (3) passing Python objects instead of tensors. For (1), please define your @tf.function outside of the loop. For (2), @tf.function has reduce_retracing=True option that can avoid unnecessary retracing. For (3), please refer to https://www.tensorflow.org/guide/function#controlling_retracing and https://www.tensorflow.org/api_docs/python/tf/function for  more details.
[I 2025-07-14 23:38:42,794] Trial 78 finished with value: -5.626022858339932 and parameters: {'model': 'mlp', 'input_units': 134, 'n_layers': 1, 'hidden_units_0': 53, 'activation': 'elu', 'mlp_learning_rate': 0.00012708332310907796, 'dropout_rate': 0.2920313001456545, 'batch_norm': True, 'epochs': 64, 'batch_size': 128}. Best is trial 77 with value: 0.6349931107854472.
[I 2025-07-14 23:38:46,079] Trial 79 finished with value: 0.5559072088252415 and parameters: {'model': 'knn', 'n_neighbors': 12, 'weights': 'distance', 'algorithm': 'kd_tree', 'p': 2}. Best is trial 77 with value: 0.6349931107854472.
[I 2025-07-14 23:50:18,408] Trial 80 finished with value: 0.5965220506673031 and parameters: {'model': 'gradient_boosting', 'n_estimators': 199, 'gb_learning_rate': 0.19738075156649237, 'max_depth': 9, 'min_samples_split': 17, 'min_samples_leaf': 9, 'subsample': 0.9830675707138334}. Best is trial 77 with value: 0.6349931107854472.
[I 2025-07-15 00:00:31,422] Trial 81 finished with value: 0.6340596507249789 and parameters: {'model': 'gradient_boosting', 'n_estimators': 189, 'gb_learning_rate': 0.04342469576384948, 'max_depth': 9, 'min_samples_split': 15, 'min_samples_leaf': 8, 'subsample': 0.9608272859261999}. Best is trial 77 with value: 0.6349931107854472.
[I 2025-07-15 00:10:41,649] Trial 82 finished with value: 0.6327127251027499 and parameters: {'model': 'gradient_boosting', 'n_estimators': 188, 'gb_learning_rate': 0.043309205038452786, 'max_depth': 9, 'min_samples_split': 16, 'min_samples_leaf': 10, 'subsample': 0.9652568657888919}. Best is trial 77 with value: 0.6349931107854472.
[I 2025-07-15 00:20:26,467] Trial 83 finished with value: 0.6329141130738598 and parameters: {'model': 'gradient_boosting', 'n_estimators': 186, 'gb_learning_rate': 0.044021371864847045, 'max_depth': 9, 'min_samples_split': 16, 'min_samples_leaf': 9, 'subsample': 0.9335381322207034}. Best is trial 77 with value: 0.6349931107854472.
[I 2025-07-15 00:31:00,083] Trial 84 finished with value: 0.6303503250752932 and parameters: {'model': 'gradient_boosting', 'n_estimators': 188, 'gb_learning_rate': 0.04829323016049765, 'max_depth': 9, 'min_samples_split': 16, 'min_samples_leaf': 9, 'subsample': 0.9835950033248988}. Best is trial 77 with value: 0.6349931107854472.
[I 2025-07-15 00:32:10,732] Trial 85 finished with value: -2741615.726972925 and parameters: {'model': 'svr', 'C': 0.6773912527655545, 'kernel': 'poly', 'gamma': 'scale', 'degree': 5}. Best is trial 77 with value: 0.6349931107854472.
[I 2025-07-15 00:38:05,518] Trial 86 finished with value: 0.6242301519718635 and parameters: {'model': 'gradient_boosting', 'n_estimators': 187, 'gb_learning_rate': 0.013196744432289461, 'max_depth': 9, 'min_samples_split': 20, 'min_samples_leaf': 9, 'subsample': 0.6013216724592377}. Best is trial 77 with value: 0.6349931107854472.
[I 2025-07-15 00:47:40,424] Trial 87 finished with value: 0.6331655686480878 and parameters: {'model': 'gradient_boosting', 'n_estimators': 183, 'gb_learning_rate': 0.041042383340759755, 'max_depth': 9, 'min_samples_split': 16, 'min_samples_leaf': 10, 'subsample': 0.9320723313808075}. Best is trial 77 with value: 0.6349931107854472.
[I 2025-07-15 00:57:56,804] Trial 88 finished with value: 0.6297090862477668 and parameters: {'model': 'gradient_boosting', 'n_estimators': 183, 'gb_learning_rate': 0.03925419339340399, 'max_depth': 9, 'min_samples_split': 16, 'min_samples_leaf': 10, 'subsample': 0.9979136467839784}. Best is trial 77 with value: 0.6349931107854472.
[I 2025-07-15 00:58:02,566] Trial 89 finished with value: 0.42580888345923545 and parameters: {'model': 'linear_regression', 'fit_intercept': True}. Best is trial 77 with value: 0.6349931107854472.
[I 2025-07-15 01:07:46,801] Trial 90 finished with value: 0.6343330290948196 and parameters: {'model': 'gradient_boosting', 'n_estimators': 193, 'gb_learning_rate': 0.021883755227291527, 'max_depth': 9, 'min_samples_split': 17, 'min_samples_leaf': 10, 'subsample': 0.9347702650890954}. Best is trial 77 with value: 0.6349931107854472.
[I 2025-07-15 01:17:28,087] Trial 91 finished with value: 0.6344751889336944 and parameters: {'model': 'gradient_boosting', 'n_estimators': 193, 'gb_learning_rate': 0.022528986142473523, 'max_depth': 9, 'min_samples_split': 17, 'min_samples_leaf': 10, 'subsample': 0.9344087485051797}. Best is trial 77 with value: 0.6349931107854472.
[I 2025-07-15 01:27:09,371] Trial 92 finished with value: 0.63507707324949 and parameters: {'model': 'gradient_boosting', 'n_estimators': 194, 'gb_learning_rate': 0.023404376456702455, 'max_depth': 9, 'min_samples_split': 17, 'min_samples_leaf': 10, 'subsample': 0.9336853132638502}. Best is trial 92 with value: 0.63507707324949.
[I 2025-07-15 01:37:31,691] Trial 93 finished with value: 0.6361404608550759 and parameters: {'model': 'gradient_boosting', 'n_estimators': 194, 'gb_learning_rate': 0.022066874983270316, 'max_depth': 10, 'min_samples_split': 18, 'min_samples_leaf': 10, 'subsample': 0.9296908181849177}. Best is trial 93 with value: 0.6361404608550759.
[I 2025-07-15 01:47:33,832] Trial 94 finished with value: 0.6218934773194706 and parameters: {'model': 'gradient_boosting', 'n_estimators': 196, 'gb_learning_rate': 0.010918063070650422, 'max_depth': 10, 'min_samples_split': 18, 'min_samples_leaf': 10, 'subsample': 0.9239443211490042}. Best is trial 93 with value: 0.6361404608550759.
[I 2025-07-15 01:48:17,351] Trial 95 finished with value: 0.5803898727326354 and parameters: {'model': 'random_forest', 'n_estimators': 193, 'max_depth': 10, 'min_samples_split': 17, 'min_samples_leaf': 10, 'rf_max_features': 'log2'}. Best is trial 93 with value: 0.6361404608550759.
[I 2025-07-15 01:57:39,379] Trial 96 finished with value: 0.6354927252183371 and parameters: {'model': 'gradient_boosting', 'n_estimators': 193, 'gb_learning_rate': 0.02371236796316698, 'max_depth': 9, 'min_samples_split': 18, 'min_samples_leaf': 10, 'subsample': 0.9040484371722003}. Best is trial 93 with value: 0.6361404608550759.
[I 2025-07-15 02:07:42,190] Trial 97 finished with value: 0.6371595622366669 and parameters: {'model': 'gradient_boosting', 'n_estimators': 193, 'gb_learning_rate': 0.020993680984793886, 'max_depth': 10, 'min_samples_split': 19, 'min_samples_leaf': 9, 'subsample': 0.9043349706436498}. Best is trial 97 with value: 0.6371595622366669.
[I 2025-07-15 02:07:42,592] Trial 98 finished with value: 0.49909042683409727 and parameters: {'model': 'decision_tree', 'max_depth': 11, 'min_samples_split': 19, 'min_samples_leaf': 9, 'dt_max_features': 'log2'}. Best is trial 97 with value: 0.6371595622366669.
[I 2025-07-15 02:17:40,638] Trial 99 finished with value: 0.6360203088372782 and parameters: {'model': 'gradient_boosting', 'n_estimators': 193, 'gb_learning_rate': 0.019688019549835938, 'max_depth': 10, 'min_samples_split': 19, 'min_samples_leaf': 10, 'subsample': 0.8982143933093434}. Best is trial 97 with value: 0.6371595622366669.
Best trial: 97. Best value: 0.63716: 100%|█████████████████████████████████████████████| 100/100 [7:50:20<00:00, 282.21s/it]

Meta-learning optimization completed!
Best model: gradient_boosting
Best average score across datasets: 0.6372
Best parameters: {'n_estimators': 193, 'max_depth': 10, 'min_samples_split': 19, 'min_samples_leaf': 9, 'subsample': 0.9043349706436498, 'learning_rate': 0.020993680984793886}

Test Results:

brazilian_houses:
  mse: 0.0271
  r2: 0.9568

superconductivity:
  mse: 20.1573
  r2: 0.9823

bike_sharing_demand:
  mse: 1205.8090
  r2: 0.9625

yprop_4_1:
  mse: 0.0001
  r2: 0.8285

wine_quality:
  mse: 0.0845
  r2: 0.8916

Best model architecture:
GradientBoostingRegressor(learning_rate=0.020993680984793886, max_depth=10,
                          min_samples_leaf=9, min_samples_split=19,
                          n_estimators=193, subsample=0.9043349706436498)